tweet_id,text,language,type,bookmark_count,favorite_count,retweet_count,reply_count,view_count,created_at,client,hashtags,urls,media_type,media_urls
'1729216596298592761',"Premier @MorawieckiM w programie #GośćWiadomości na antenie @tvp_info: Przeanalizowaliśmy bardzo skrupulatnie programy innych partii i staraliśmy się wybrać - w ramach ponadpartyjnego rządu, to, co łączy. Nie chcemy zemsty i rewanżyzmu. Myślę, że Polacy oczekują dobrego, merytorycznego i konstruktywnego programu.",pl,Retweet,4,653,172,494,102079,2023-11-27 20:12:18,"<a href=""https://mobile.twitter.com"" rel=""nofollow"">Twitter Web App</a>",#GośćWiadomości,,photo,https://pbs.twimg.com/media/F_9ozASXMAAWb6i.jpg
'1729085084844667142',"Chcecie poznać bilans 8 lat rządów @pisorgpl? Oto, co piszą o polskiej gospodarce media na całym świecie! 
📊 📈🇵🇱

✅Najniższe bezrobocie w historii
✅ Najwyższa dynamika wzrostu PKB w UE
✅ Rekord eksportu

I tak powinno być nadal! Do tego potrzebna jest jednak zgoda, współpraca i #DekalogPolskichSpraw.",pl,Tweet,61,2760,970,1499,308668,2023-11-27 11:29:43,"<a href=""http://twitter.com/download/iphone"" rel=""nofollow"">Twitter for iPhone</a>",,,video,https://video.twimg.com/amplify_video/1729085031488827392/vid/avc1/1280x720/DEfdUUDBA_Oj9Jdd.mp4?tag=14
'1728142412084552103',"Brawo My, brawo Polsko! 😎🇵🇱",pl,Tweet,24,3079,806,843,328454,2023-11-24 21:03:53,"<a href=""http://twitter.com/download/iphone"" rel=""nofollow"">Twitter for iPhone</a>",,,,
'1728019373107839254',"Polityka społeczna musi być wyjęta ponad wszelkie spory polityczne pomiędzy partiami. Bo to bezpieczeństwo polskich rodzin - socjalne, zdrowotne, finansowe czy energetyczne  -  jest najważniejsze dla rządu @pisorgpl od 8 lat - i tak powinno zostać! 

Na tym skupia się program #DekalogPolskichSpraw.

Teraz nie jest czas na spory polityczne  - teraz jest czas na rozwiązanie 3 najważniejszych spraw dla Polaków: 
✅Przedłużenie wakacji kredytowych🏝 
✅Zamrożenie cen energii🔌
✅Przedłużenie 0% VAT na żywność 🍞",pl,Tweet,4,871,302,903,130425,2023-11-24 12:54:58,"<a href=""http://twitter.com/download/iphone"" rel=""nofollow"">Twitter for iPhone</a>",,,photo,"https://pbs.twimg.com/media/F_sodTeWgAANTie.jpg,https://pbs.twimg.com/media/F_sodTfXYAAGUit.jpg,https://pbs.twimg.com/media/F_sodTaW4AANJz7.jpg"
'1727800263975604720',"Trzy dni temu minister Izabela Antos z KPRM poprosiła ministra Jacka Cichockiego o zorganizowanie spotkania z marszałkiem @szymon_holownia.
Mamy 3 sprawy do omówienia - przedłużenie wakacji kredytowych, 0% VAT na żywność i zamrożenie cen energii. 
Rozumiem fascynację nową funkcją, ale w polityce chodzi przede wszystkim o działanie na rzecz Polaków. Dlatego ponawiam moją prośbę o spotkanie.",pl,Tweet,23,1909,463,1280,434129,2023-11-23 22:24:18,"<a href=""http://twitter.com/download/iphone"" rel=""nofollow"">Twitter for iPhone</a>",,,,
'1727696524975522044',"Panie Marszałku @szymon_holownia - nie ma na co czekać i nie ma o co się spierać!
✅Przedłużenie wakacji kredytowych🏝 
✅Zamrożenie cen energii🔌
✅Przedłużenie 0% VAT na żywność 🍞
to 3 sprawy, którymi MUSI zająć się Sejm Rzeczypospolitej Polskiej już TERAZ⚠️ 
Działajmy wspólnie dla bezpieczeństwa finansowego polskich rodzin! 
👨‍👩‍👧‍👦🇵🇱",pl,Tweet,47,2498,700,2081,705168,2023-11-23 15:32:05,"<a href=""http://twitter.com/download/iphone"" rel=""nofollow"">Twitter for iPhone</a>",,,video,https://video.twimg.com/amplify_video/1727696465462464513/vid/avc1/960x540/FxCby_ydCJtVgSzE.mp4?tag=14
'1727392724691599431',"Dziewięciu europosłów z Polski wybranych z list Koalicji Obywatelskiej i Lewicy przeważyło szalę i spowodowało, że Parlament Europejski przyjął rezolucję wzywającą do radykalnej zmiany traktatów dotyczących UE.

Mimo wczorajszych zapewnień Donalda Tuska, ludzie go popierający zaakceptowali prawo UE do nakładania podatków według ich postanowień, do odebrania nadzoru państw członkowskich nad granicami i do odebrania wielu innych funkcji państwa, a w konsekwencji całkowitej zależności Polski i innych państw członkowskich od decyzji Brukseli i od woli dwóch najsilniejszych państw w Unii.",pl,Tweet,86,3607,1236,1660,589892,2023-11-22 19:24:53,"<a href=""http://twitter.com/download/iphone"" rel=""nofollow"">Twitter for iPhone</a>",,,photo,https://pbs.twimg.com/media/F_juhlHWkAAxqKs.jpg
'1726624508105400323',"Bezpieczeństwo socjalne i obrona Polaków przed wzrostem cen to priorytety @pisorgpl w kolejnej kadencji Sejmu RP i nic się pod tym względem nie zmieni! 
Dziś złożyliśmy projekt ustawy o przedłużeniu zerowej stawki VAT na żywność w 2024 roku! 🇵🇱 👨‍👩‍👧‍👦🛡❤️ https://t.co/WUMelXfuwJ",pl,Tweet,10,1875,518,1141,196929,2023-11-20 16:32:16,"<a href=""http://twitter.com/download/iphone"" rel=""nofollow"">Twitter for iPhone</a>",,,photo,https://pbs.twimg.com/media/F_Yz1jtW0AABu5H.jpg
'1726594146100457683',"Dziś skupiamy się na 2 kolejnych tematach z #DekalogPolskichSpraw:
✅sprawach społecznych;
✅edukacji i zdrowiu.

Wiemy, skąd wziąć pieniądze, a Polacy wiedzą, że gdy coś obiecamy - to to wprowadzimy. 

Najłatwiej działać wspólnie, dlatego raz jeszcze apeluję - w oparciu o ten program zbudujmy Koalicję Polskich Spraw i razem działajmy dla dobra Polski! 🇵🇱🛡👨‍👩‍👧‍👦❤️",pl,Tweet,14,1050,316,1033,165383,2023-11-20 14:31:37,"<a href=""http://twitter.com/download/iphone"" rel=""nofollow"">Twitter for iPhone</a>",#DekalogPolskichSpraw,,photo,"https://pbs.twimg.com/media/F_YYOQeW8AAEBM3.jpg,https://pbs.twimg.com/media/F_YYOQeWwAAna8p.jpg,https://pbs.twimg.com/media/F_YYOQeXgAAbhkK.jpg"
'1726566865257042172',"Premier @MorawieckiM w #Warszawa: Rząd będzie eksperckim i ponadpartyjnym organem, który będzie wspierał i realizował politykę społeczną. https://t.co/GCoQDtr7JZ",pl,Retweet,1,263,75,303,47059,2023-11-20 12:43:13,"<a href=""http://twitter.com/download/iphone"" rel=""nofollow"">Twitter for iPhone</a>",#Warszawa,,photo,https://pbs.twimg.com/media/F_X_Yw-XkAA3W_t.jpg
'1726568010302079324',"🇵🇱 #DekalogPolskichSpraw, ponieważ Polska jest najważniejsza ⤵️ https://t.co/oeMoSSYLTD",pl,Retweet,2,126,44,57,35328,2023-11-20 12:47:46,"<a href=""http://twitter.com/download/iphone"" rel=""nofollow"">Twitter for iPhone</a>",#DekalogPolskichSpraw,,photo,https://pbs.twimg.com/media/F_YAcQZWsAAVv1P.jpg
'1726570058112250225',"Premier @MorawieckiM: W oparciu o #DekalogPolskichSpraw powinniśmy zbudować #KoalicjaPolskichSpraw, która będzie realizować programy tak, jak życzą sobie tego Polki i Polacy. https://t.co/A08uACCc9a",pl,Retweet,3,207,80,161,40812,2023-11-20 12:55:54,"<a href=""http://twitter.com/download/iphone"" rel=""nofollow"">Twitter for iPhone</a>","#DekalogPolskichSpraw,#KoalicjaPolskichSpraw",,photo,"https://pbs.twimg.com/media/F_YCTnjXkAA3KNp.jpg,https://pbs.twimg.com/media/F_YCTnlW0AAyusu.jpg,https://pbs.twimg.com/media/F_YCTnnXUAA7KxE.jpg,https://pbs.twimg.com/media/F_YCTnqXQAAagC_.jpg"
'1726565291956593050',"Premier @MorawieckiM w #Warszawa: Poszukiwaliśmy wspólnych punktów w innych programach, które są podobne do naszych. Chcę odejść od pustych frazesów ujętych w tzw. 24. ogólnikach. Mam apel do parlamentarzystów - was wybrali wyborcy i jesteście zobowiązani wobec nich. Główny lider opozycji chce odejść od waszych głównych punktów programowych.",pl,Retweet,3,256,71,233,46595,2023-11-20 12:36:58,"<a href=""http://twitter.com/download/iphone"" rel=""nofollow"">Twitter for iPhone</a>",#Warszawa,,photo,https://pbs.twimg.com/media/F_X99DKXYAAX6Hs.jpg
'1725390955107303666',#DziśwFakcie: Pierwszy wywiad z premierem @MorawieckiM po wyborach. Wskazał trzy największe błędy @pisorgpl [TYLKO W FAKCIE]➡️https://t.co/1A5XnPUDje https://t.co/17JIpeUGoh,pl,Retweet,5,115,35,183,43980,2023-11-17 06:50:34,"<a href=""https://mobile.twitter.com"" rel=""nofollow"">Twitter Web App</a>",#DziśwFakcie,https://www.fakt.pl/pieniadze/pierwszy-wywiad-morawieckiego-po-wyborach-wskazal-trzy-najwieksze-bledy-pis/tq6swmy?fbclid=IwAR2brjJmkhjVZt9eJrkCf_jStFmIWXDK_wlIPT2iovzmzd2lF67pLYF5QWo,photo,https://pbs.twimg.com/media/F_HRkn5X0AA3ut4.jpg
'1725247536112292132',"Na nieformalnym spotkaniu wybranych liderów Unii Europejskiej, które odbyło się dzisiaj w Zagrzebiu🇭🇷 rozmawialiśmy przede wszystkim o:

✅ Strategii programowej UE na lata 2024–2029
✅ Celach finansowania wspólnego budżetu
✅ Kluczowych wyzwaniach stojących przed UE. 🇪🇺 https://t.co/zy2JINhMnA",pl,Tweet,2,940,236,468,104560,2023-11-16 21:20:40,"<a href=""http://twitter.com/download/iphone"" rel=""nofollow"">Twitter for iPhone</a>",,,photo,"https://pbs.twimg.com/media/F_FPeYaWQAADW1f.jpg,https://pbs.twimg.com/media/F_FPeYhW8AAh35w.jpg"
'1725239069049835629',"🇵🇱🇭🇷 Today PM @MorawieckiM takes part in an informal meeting of leaders of European Union countries in #Zagreb. Main topics of discussion:
✅ EU Strategic Agenda for 2024–2029,
✅ key challenges for 🇪🇺,
✅ financing objectives of common budget. https://t.co/O77geQWQ5w",en,Retweet,2,91,23,22,20245,2023-11-16 20:47:02,"<a href=""https://mobile.twitter.com"" rel=""nofollow"">Twitter Web App</a>",#Zagreb,,photo,"https://pbs.twimg.com/media/F_FB-nRXUAADnkg.jpg,https://pbs.twimg.com/media/F_FB_o_XMAABM95.jpg,https://pbs.twimg.com/media/F_FCBWNXwAAuUQe.jpg,https://pbs.twimg.com/media/F_FCCJ4W4AAEXxf.jpg"
'1725074293397020742',"Skierowaliśmy do @KancelariaSejmu projekt ustawy o wakacjach kredytowych na rok 2024! Sejm na kolejnym posiedzeniu powinien zająć się tą ustawą.

Zwracam się do Pana Marszałka @szymon_holownia z prośbą o sprawne procedowanie tej sprawy. 🇵🇱🛡🏠👨‍👩‍👧‍👦 https://t.co/zbHYc6eIBG",pl,Tweet,5,1387,391,747,254741,2023-11-16 09:52:16,"<a href=""http://twitter.com/download/iphone"" rel=""nofollow"">Twitter for iPhone</a>",,,photo,https://pbs.twimg.com/media/F_Cx7RMXUAAyU4A.jpg
'1724068564477354038',"Praca dla Was to najlepsza praca.
Rozpoczynamy X kadencję Sejmu.✌🏻 https://t.co/zvVwMit9Gi",pl,Tweet,17,2792,377,1480,301862,2023-11-13 15:15:52,"<a href=""http://twitter.com/download/iphone"" rel=""nofollow"">Twitter for iPhone</a>",,,photo,https://pbs.twimg.com/media/F-0fOCXWsAAcmn7.jpg
'1723277913028460953',"Niepodległość jest jak miłość. Trzeba o nią dbać. Trzeba ją szanować. Trzeba ją doceniać. I trzeba o nią walczyć każdego dnia! 
Czynami, a nie tylko słowami, sloganami czy deklaracjami.

Codziennie wspólnie piszemy kolejne strony historii Polski. Niepodległość jest ciągłą pracą nad lepszą przyszłością dla naszych dzieci. Każdy z nas się do tego przyczynia – od rolnika na Podlasiu, młodej mamy z Elbląga, przedsiębiorcy na Śląsku, nauczyciela w Poznaniu, po lekarza w Krakowie. Spełniamy swoje role, cieszymy się i rozwijamy, budujemy wspólnotę wolnych ludzi w bezpiecznym kraju. 

Radośnie świętujmy to co nas łączy, a nie dzieli. Niech żyje niepodległa, bezpieczna i zjednoczona Rzeczpospolita! 🇵🇱🤍❤️",pl,Tweet,24,4385,1034,1205,308197,2023-11-11 10:54:06,"<a href=""http://twitter.com/download/iphone"" rel=""nofollow"">Twitter for iPhone</a>",,,photo,https://pbs.twimg.com/media/F-pQIGIW4AA54eA.jpg
'1723251326849593671',105. rocznica odzyskania niepodległości 🇵🇱 #11listopada https://t.co/5B2ezNdMjr,pl,Retweet,2,376,100,60,30823,2023-11-11 09:08:27,"<a href=""http://twitter.com/download/iphone"" rel=""nofollow"">Twitter for iPhone</a>",#11listopada,,photo,https://pbs.twimg.com/media/F-o38feWEAA9srg.jpg
'1723029405100818463',"Miało być 100 konkretów, a skończyło się na 24 ogólnikach. Platforma rozstawia pozostałych po kątach. To nie jest zapowiedź koalicji równoprawnych partnerów, którzy mają wizję  i wiedzą jak odpowiedzieć na wyzwania stojące przed Polską.",pl,Tweet,30,5166,982,3546,717803,2023-11-10 18:26:37,"<a href=""http://twitter.com/download/iphone"" rel=""nofollow"">Twitter for iPhone</a>",,,,
'1722578978760708212',"Serdecznie gratuluję wszystkim funkcjonariuszom polskich służb mundurowych i Wojska Polskiego, którzy otrzymali dziś awanse generalskie. Dziękuję za Waszą służbę! 🇵🇱 https://t.co/Z5QAwdROk9",pl,Tweet,3,1110,219,308,94919,2023-11-09 12:36:47,"<a href=""http://twitter.com/download/iphone"" rel=""nofollow"">Twitter for iPhone</a>",,,photo,"https://pbs.twimg.com/media/F-fUcyoX0AEitTh.jpg,https://pbs.twimg.com/media/F-fUcymWIAAQYlM.jpg,https://pbs.twimg.com/media/F-fUcymXQAALKs7.jpg"
'1721634500810051735',"15 października Rodacy opowiedzieli się za parlamentem, w którym nie dominuje jedna partia, ale w którym dominować ma współpraca.

Misja, jaką powierzył mi prezydent @AndrzejDuda to wielki zaszczyt, ale i wyzwanie. Dziękuję @prezydentpl za zaufanie. Zapraszam do współpracy wszystkich parlamentarzystów, którzy na pierwszym miejscu stawiają Polskę.",pl,Tweet,65,5628,892,4693,1023024,2023-11-06 22:03:46,"<a href=""http://twitter.com/download/iphone"" rel=""nofollow"">Twitter for iPhone</a>",,,,
'1720772550140072106',"Chcę odwołać się do tych posłów Trzeciej Drogi, Konfederacji i innych klubów, którym bliski jest program społeczny, suwerennościowy i kwestia walki z nielegalną migracją. 

Zachęcam do mojego wywiadu w  @Int_Wydarzenia ➡️ https://t.co/uOoB7uX3yg",pl,Tweet,70,3307,777,3361,816281,2023-11-04 12:58:41,"<a href=""http://twitter.com/download/iphone"" rel=""nofollow"">Twitter for iPhone</a>",,"https://wydarzenia.interia.pl/tylko-w-interii/news-mateusz-morawiecki-nie-jestem-spakowany-licze-na-przekonanie,nId,7128747",,
'1719997543919043043',"Komisja Europejska i rynki finansowe pozytywnie oceniają finanse publiczne w Polsce, ale spin doktorzy Platformy Obywatelskiej walczą, aby wbić do głowy kolejne kłamstwo.

Dlaczego? O co w tym chodzi? 

Chodzi o jedną podstawową kwestię: WYCOFAĆ SIĘ Z OBIETNIC WYBORCZYCH. 

➡️ Przeczytaj więcej: https://t.co/JqBTBwqrUZ",pl,Tweet,30,3441,1066,1109,515380,2023-11-02 09:39:05,"<a href=""http://twitter.com/download/iphone"" rel=""nofollow"">Twitter for iPhone</a>",,,,
'1717905645775581614',"PM @MorawieckiM: I also pointed out the risks of the work currently underway in @Europarl_EN. As a consequence, one or another qualified majority procedure will deprive Poland of the right to decide its own future. https://t.co/w83io8i14y",en,Retweet,4,139,43,106,41903,2023-10-27 16:06:37,"<a href=""https://mobile.twitter.com"" rel=""nofollow"">Twitter Web App</a>",,,photo,https://pbs.twimg.com/media/F9c6CQVX0AAfYGc.jpg
'1717905818492776660',"PM @MorawieckiM: To sum up this #EuropeanCouncil, I would say that in the long discussion on the situation in the #MiddleEast, it turned out that our warnings against terrorism and the wave of migration were understood. In Ukrainian issues, the conclusions also fulfill security requirements and our Polish interests.",en,Retweet,2,98,36,34,33885,2023-10-27 16:07:18,"<a href=""https://mobile.twitter.com"" rel=""nofollow"">Twitter Web App</a>","#EuropeanCouncil,#MiddleEast",,photo,https://pbs.twimg.com/media/F9c6JWcWYAAAfgp.jpg
'1717920924266106917',"🇵🇱 🇪🇺  W dniach 26-27.10 premier @MorawieckiM uczestniczył w posiedzeniu Rady Europejskiej w 🇧🇪 ⤵️

🔸 Podczas spotkań szef 🇵🇱 rządu omawiał z europejskimi liderami tematy wojny na terenie 🇺🇦, konfliktu na Bliskim Wschodzie oraz nielegalnej imigracji, która w dużym stopniu dotyczy bezpieczeństwa Polski i jej granic.",pl,Retweet,3,389,137,191,74797,2023-10-27 17:07:20,"<a href=""http://twitter.com/download/android"" rel=""nofollow"">Twitter for Android</a>",,,video,https://video.twimg.com/ext_tw_video/1717920801423335424/pu/vid/avc1/720x720/ulwYBMIp7tEBkz8a.mp4?tag=12
'1717900669070283241',"🇪🇺 Premier @MorawieckiM w #Bruksela: W długiej dyskusji o sytuacji na Bliskim Wschodzie okazało się, że te nasze przestrogi przed terroryzmem, przed falą imigracji spotkały się ze zrozumieniem. A w kwestiach ukraińskich, znalazły się konkluzje RE, które odpowiadają także wymogom bezpieczeństwa - tak, jak my je rozumiemy i jaki mają wpływ na polskie interesy.",pl,Retweet,2,323,98,129,52587,2023-10-27 15:46:51,"<a href=""http://twitter.com/download/android"" rel=""nofollow"">Twitter for Android</a>",#Bruksela,,photo,https://pbs.twimg.com/media/F9c1jb6XsAA34Of.jpg
'1717845574198669625',"W obwodzie tarnopolskim na Ukrainie polscy i ukraińscy badacze znaleźli dół z ciałami ofiar Rzezi Wołyńskiej. 

W lipcu, podczas wizyty na Ukrainie w miejscowości Puźniki, pisałem, że prawda o Zbrodni Wołyńskiej musi być naszym mostem do przyszłości, który zbudujemy nad potokiem nienawiści.

Prace trwają i będą kontynuowane. Doprowadzimy tę sprawę do końca. Jesteśmy to winni tysiącom ofiar Wołynia i ich rodzinom. 🇵🇱",pl,Tweet,29,2166,656,563,216736,2023-10-27 12:07:55,"<a href=""http://twitter.com/download/iphone"" rel=""nofollow"">Twitter for iPhone</a>",,,video,https://video.twimg.com/amplify_video/1717844737170833408/vid/avc1/720x946/D58mKHTu_yemg7_4.mp4?tag=14
'1717134355041075611',"Premier @MorawieckiM w #KPRM: Jeżeli ktoś mówi inaczej, to chce się wyłgać z obietnic wyborczych albo pozabierać część programów społecznych, środki na inwestycje w Polsce lokalnej, albo nie ma zielonego pojęcia, bo liczby i fakty pokazują prawdę. https://t.co/shs8twpktt",pl,Retweet,7,434,224,261,41901,2023-10-25 13:01:47,"<a href=""http://twitter.com/download/iphone"" rel=""nofollow"">Twitter for iPhone</a>",#KPRM,,photo,https://pbs.twimg.com/media/F9R8l5SXAAAZity.jpg
'1717131230452342974',Premier @MorawieckiM w #KPRM: Zależy nam na stabilnym budżecie i dobrych perspektywach gospodarczych. https://t.co/qQlzJJcaMS,pl,Retweet,4,228,91,105,30309,2023-10-25 12:49:22,"<a href=""http://twitter.com/download/iphone"" rel=""nofollow"">Twitter for iPhone</a>",#KPRM,,photo,https://pbs.twimg.com/media/F9R5wDGXMAAaRgz.jpg
'1717130698371252711',"Premier @MorawieckiM w #KPRM: Wyprowadziliśmy finanse publiczne z wielkiego kryzysu odziedziczonego po naszych poprzednikach, a następnie przeprowadziliśmy ją przez serię kryzysów. 
🇵🇱 Mamy najniższe bezrobocie w historii III RP i największą liczbę osób pracujących. https://t.co/zKwKZx1fwI",pl,Retweet,2,329,109,111,35006,2023-10-25 12:47:15,"<a href=""http://twitter.com/download/iphone"" rel=""nofollow"">Twitter for iPhone</a>",#KPRM,,photo,https://pbs.twimg.com/media/F9R5Q-PXUAAkks5.jpg
'1717129994403512622',"Premier @MorawieckiM w #KPRM: Ograniczyliśmy również zależność Polski od finansowania z zagranicy. Potrafiliśmy znacząco to zmniejszyć, co jest miarą niezależności i siły gospodarczej każdego państwa. https://t.co/CxpanhlSXE",pl,Retweet,4,334,123,71,28534,2023-10-25 12:44:28,"<a href=""http://twitter.com/download/iphone"" rel=""nofollow"">Twitter for iPhone</a>",#KPRM,,photo,https://pbs.twimg.com/media/F9R4oHZWwAAaW6t.jpg
'1717128674749694184',"Premier @MorawieckiM w #KPRM: Podatek CIT jest czymś bez precedensu - po 8 latach rządów naszych poprzedników do budżetu wpływało mniej środków niż wcześniej - to prawie 200% wzrostu. To tam są środki, które przeznaczamy na politykę społeczną, obronną, inwestycje lokalne. To wszystko zadziało się przy ogromnej obniżce podatku CIT dla MŚP i wielu innych ulgach podatkowych.",pl,Retweet,5,326,135,85,40083,2023-10-25 12:39:13,"<a href=""http://twitter.com/download/iphone"" rel=""nofollow"">Twitter for iPhone</a>",#KPRM,,photo,https://pbs.twimg.com/media/F9R3bT1WwAA2cGO.jpg
'1717127130058760515',Premier @MorawieckiM w #KPRM: Budżet Polski jest dzisiaj w stanie pokryć ogromne zobowiązania polityki społecznej. Są zaplanowane pieniądze na wzmocnienie naszego bezpieczeństwa - wzrost z ponad 37 mld zł do ponad 158 mld zł. https://t.co/f5jZlfWbqd,pl,Retweet,6,242,105,43,24732,2023-10-25 12:33:05,"<a href=""http://twitter.com/download/iphone"" rel=""nofollow"">Twitter for iPhone</a>",#KPRM,,photo,https://pbs.twimg.com/media/F9R2BZsWIAAtHoX.jpg
'1717123861869727746',"Premier @MorawieckiM w #KPRM: Dzisiaj stajemy przed bardzo ważnym momentem, w którym trzeba zaplanować pieniądze na przyszły rok. Udowodniliśmy, że wszystkie zapowiadane programy są wdrażane i że są pieniądze w budżecie. Chcę dzisiaj pokazać faktyczny stan finansów publicznych 🇵🇱 https://t.co/wtX89Kqsp3",pl,Retweet,2,496,178,327,47174,2023-10-25 12:20:05,"<a href=""http://twitter.com/download/iphone"" rel=""nofollow"">Twitter for iPhone</a>",#KPRM,,photo,https://pbs.twimg.com/media/F9RzDECXMAEHPaS.jpg
'1717076892354785409',"Odeszła Wanda Półtawska.

Przyjaciółka Jana Pawła II, która była naszym łącznikiem z dziedzictwem Papieża Polaka. Doktor nauk medycznych, profesor Papieskiej Akademii Teologicznej, harcerka, więźniarka niemieckiego obozu Ravensbrück, świadek historii Polski. Wzór wszelkiej szlachetności. 

Niech spoczywa w pokoju. 🇵🇱",pl,Tweet,16,2174,410,475,199471,2023-10-25 09:13:27,"<a href=""http://twitter.com/download/iphone"" rel=""nofollow"">Twitter for iPhone</a>",,,photo,https://pbs.twimg.com/media/F9RIVHuWsAAQ85U.jpg
'1714939892768112662',"Premier @MorawieckiM podczas uroczystych obrad XXXI Krajowego Zjazdu Delegatów NSZZ „Solidarność” w #Spała: #Solidarność to jedność serc, umysłów i rąk -  zjednoczonych i zakorzenionych w ideałach, które zdolne są przemieniać świat. Te słowa ks. Jerzego Popiełuszki muszą być dla nas drogowskazem.",pl,Retweet,1,460,118,332,66256,2023-10-19 11:41:47,"<a href=""http://twitter.com/download/android"" rel=""nofollow"">Twitter for Android</a>","#Spała,#Solidarność",,photo,https://pbs.twimg.com/media/F8ywuQkXQAInmPP.jpg
'1714945345761820883',"Premier @MorawieckiM w #Spała: #Solidarność ma wielką przeszłość oraz przyszłość. Jest symbolem ciągłości ideałów z sierpnia 1980 r., ale także stara się rozpoznawać znaki czasu i wytyczać kierunek na przyszłość. Bitwa o Polskę trwa i będzie trwała wiele lat - to wielkie zadanie. https://t.co/zVEpoEzPFL",pl,Retweet,1,392,102,192,50062,2023-10-19 12:03:27,"<a href=""http://twitter.com/download/android"" rel=""nofollow"">Twitter for Android</a>","#Spała,#Solidarność",,photo,https://pbs.twimg.com/media/F8y1qLZXAAAmSWG.jpg
'1714219458028245135',"Dziękuję za każdy głos! Nie zawiodę Was!
Niech żyje Polska! ❤️🇵🇱❤️ https://t.co/NPGeTUBvk3",pl,Tweet,18,5401,691,2870,563542,2023-10-17 11:59:02,"<a href=""http://twitter.com/download/iphone"" rel=""nofollow"">Twitter for iPhone</a>",,,photo,https://pbs.twimg.com/media/F8ohgiGWgAA7nfM.jpg
'1713634580974957005',"❗️WYGRALIŚMY❗️
❗️Prawo i Sprawiedliwość zwycięzcą wyborów parlamentarnych 2023❗️
❤️🇵🇱❤️
Dziękujemy. Niech żyje Polska❗️ https://t.co/TiYjnXWSUf",pl,Tweet,105,8722,1162,9671,3591446,2023-10-15 21:14:56,"<a href=""http://twitter.com/download/iphone"" rel=""nofollow"">Twitter for iPhone</a>",,,photo,https://pbs.twimg.com/media/F8gNkFHWkAAGzqy.jpg
'1713494857853878385',"My już zagłosowaliśmy! ✅🗳️🇵🇱

PS. Pamiętajcie, że wszelkie komentarze czy dodatkowe pytania o kartę referendalną – ze strony kogokolwiek, również członków komisji wyborczych – są sugestią i łamaniem ciszy wyborczej. Należy to zgłaszać. https://t.co/u43WL2JVYc",pl,Tweet,21,5117,948,2410,935727,2023-10-15 11:59:43,"<a href=""http://twitter.com/download/iphone"" rel=""nofollow"">Twitter for iPhone</a>",,,photo,"https://pbs.twimg.com/media/F8eOfWJX0AAeF-N.jpg,https://pbs.twimg.com/media/F8eOfWKWoAA61bs.jpg"
'1713211888325067104',Dobra robota. Tak jak mówiłem 👮‍♀️😎👮‍♀️,pl,Tweet,13,3235,449,717,662894,2023-10-14 17:15:18,"<a href=""http://twitter.com/download/iphone"" rel=""nofollow"">Twitter for iPhone</a>",,,,
'1713208271299883311',Spokojna sobota. 😀🚲 https://t.co/HOr7YvoVNS,pl,Tweet,27,4169,505,1408,681463,2023-10-14 17:00:56,"<a href=""http://twitter.com/download/iphone"" rel=""nofollow"">Twitter for iPhone</a>",,,photo,"https://pbs.twimg.com/media/F8aJ0Q-XEAAl88U.jpg,https://pbs.twimg.com/media/F8aJ0RDWkAAVkWE.jpg"
'1713152875872894982',"Wszyscy obywatele Polski i innych krajów, które skorzystały z pomocy Polski są już w domach. Sześciodniowa ewakuacja Polaków z objętym konfliktem Izraela dobiegła końca. Dziękuję żołnierzom za tak sprawne działanie!",pl,Tweet,9,2831,602,454,212740,2023-10-14 13:20:49,"<a href=""http://twitter.com/download/iphone"" rel=""nofollow"">Twitter for iPhone</a>",,,,
'1712947710100185420',"To był długi dzień i mimo późnej pory, nie zwalniamy tempa. Zwyciężymy! 💪🇵🇱😎 #TylkoPiS https://t.co/Za0HFRm4PT",pl,Tweet,4,1047,145,300,95932,2023-10-13 23:45:33,"<a href=""http://twitter.com/download/iphone"" rel=""nofollow"">Twitter for iPhone</a>",#TylkoPiS,,photo,"https://pbs.twimg.com/media/F8Wc29FW0AAXTle.jpg,https://pbs.twimg.com/media/F8Wc29EWMAAkHT2.jpg,https://pbs.twimg.com/media/F8Wc29DWgAALehp.jpg,https://pbs.twimg.com/media/F8Wc28_XQAABjpx.jpg"
